{
  "schema_version": 1,
  "record_type": "commit_evidence",
  "ai_log_id": "log-aba26c6c3d064885bcb2d07c",
  "created_at": "2026-07-19T03:18:55.671113Z",
  "member_id": "nmhongtram",
  "branch": "tram",
  "parent_commit": "7ccfc57da001417791b2954e1465c1e7acd424ee",
  "task_records": [
    "local-20260718-ai-log-onboard"
  ],
  "prompt_ids": [],
  "tools": [],
  "capture_status": "no_new_prompt",
  "warnings": [],
  "operation": "commit",
  "replaces_ai_log": null
}
