{
  "schema_version": 1,
  "record_type": "commit_evidence",
  "ai_log_id": "log-265c4077f0874531b15e6f25",
  "created_at": "2026-07-18T23:35:30.019279Z",
  "member_id": "hdtruong802",
  "branch": "fix/local-20260719-ai-log-waiver",
  "parent_commit": "03960f3e1d0e4cc8ae8ae9a8140b68c8b8c326dc",
  "task_records": [
    "local-20260719-pr32-merge-readiness"
  ],
  "prompt_ids": [],
  "tools": [],
  "capture_status": "warning",
  "warnings": [
    "manual_prompt_required"
  ],
  "operation": "commit",
  "replaces_ai_log": null
}
