{
  "schema_version": 1,
  "record_type": "commit_evidence",
  "ai_log_id": "log-e3080ae6ff3a47408ae3c7c6",
  "created_at": "2026-07-18T20:27:00.504418Z",
  "member_id": "nmhongtram",
  "branch": "tram",
  "parent_commit": "bd534977405c94fec63c0a765016ecd3c9765f89",
  "task_records": [
    "local-20260718-ai-log-onboard"
  ],
  "prompt_ids": [],
  "tools": [],
  "capture_status": "no_new_prompt",
  "warnings": [],
  "operation": "commit",
  "replaces_ai_log": null
}
