{
  "schema_version": 1,
  "record_type": "commit_evidence",
  "ai_log_id": "log-84d5864fc2c34f25aabd0262",
  "created_at": "2026-07-19T02:31:00.575810Z",
  "member_id": "nmhongtram",
  "branch": "tram",
  "parent_commit": "8c271ecf39163e848e6a00d80d388a865ebd87f3",
  "task_records": [
    "local-20260718-ai-log-onboard"
  ],
  "prompt_ids": [],
  "tools": [],
  "capture_status": "git_operation",
  "warnings": [],
  "operation": "merge",
  "replaces_ai_log": null
}
