{
  "schema_version": 1,
  "record_type": "commit_evidence",
  "ai_log_id": "log-dc027a0bbe8d4f298de39b73",
  "created_at": "2026-07-18T20:44:39.612308Z",
  "member_id": "nmhongtram",
  "branch": "tram",
  "parent_commit": "bf11609ef0f9beac6427bff7de86b1de0e82fefa",
  "task_records": [
    "local-20260718-ai-log-onboard"
  ],
  "prompt_ids": [],
  "tools": [],
  "capture_status": "no_new_prompt",
  "warnings": [],
  "operation": "commit",
  "replaces_ai_log": null
}
