{
  "schema_version": 1,
  "record_type": "commit_evidence",
  "ai_log_id": "log-69c02756c05142419468416d",
  "created_at": "2026-07-18T13:20:58.012484Z",
  "member_id": "hdtruong802",
  "branch": "fix/local-20260718-main-ci-api-integration",
  "parent_commit": "a3cd82b31d9b1c71e3386ea89b6c8781564b214f",
  "task_records": [
    "local-20260718-main-ci-api-integration"
  ],
  "prompt_ids": [
    "prompt-f1f1b30f9a7e4905837520eb"
  ],
  "tools": [
    "codex"
  ],
  "capture_status": "manual",
  "warnings": [],
  "operation": "commit",
  "replaces_ai_log": null
}
