{
  "schema_version": 1,
  "record_type": "commit_evidence",
  "ai_log_id": "log-719a80bddafe4f54bb07b447",
  "created_at": "2026-07-18T04:24:01.494967Z",
  "member_id": "hdtruong802",
  "branch": "fix/local-20260718-backend-ci-format",
  "parent_commit": "169404cf9f39655106e18c7ea5570183601fe609",
  "task_records": [
    "local-20260718-backend-ci-format"
  ],
  "prompt_ids": [
    "prompt-85f2872e9e13ecd57e1d41db"
  ],
  "tools": [
    "codex"
  ],
  "capture_status": "manual",
  "warnings": [],
  "operation": "commit",
  "replaces_ai_log": null
}
