{
  "schema_version": 1,
  "record_type": "commit_evidence",
  "ai_log_id": "log-639d7c11b101d432672747bf",
  "created_at": "2026-07-18T13:50:29.604Z",
  "member_id": "trantuan4132",
  "branch": "feature/semantic-search-upgrade",
  "parent_commit": "da8362fbaf19a3626595004d956ec108297cef54",
  "task_records": [
    "local-20260718-semantic-search-upgrade"
  ],
  "prompt_ids": [],
  "tools": [
    "claude"
  ],
  "capture_status": "manual",
  "warnings": [
    "manual_prompt_required"
  ],
  "operation": "commit",
  "replaces_ai_log": null
}
