{
  "schema_version": 1,
  "record_type": "commit_evidence",
  "ai_log_id": "log-2134113e20964384b19a994d",
  "created_at": "2026-07-18T11:59:34.662209Z",
  "member_id": "nmhongtram",
  "branch": "dev-ci-fix",
  "parent_commit": "6c302e8936b0adb4c8b808e8bade767df810f64c",
  "task_records": [
    "local-20260718-ai-log-onboard"
  ],
  "prompt_ids": [],
  "tools": [],
  "capture_status": "no_new_prompt",
  "warnings": [],
  "operation": "commit",
  "replaces_ai_log": null
}
