{
  "schema_version": 1,
  "record_type": "commit_evidence",
  "ai_log_id": "log-9a55fb25ecc64baa9503a439",
  "created_at": "2026-07-18T07:21:42.487029Z",
  "member_id": "hdtruong802",
  "branch": "truong",
  "parent_commit": "abb9392ab0fdc8f872d34dfe396bdcabfb016de7",
  "task_records": [
    "local-20260718-truong-dev-sync"
  ],
  "prompt_ids": [
    "prompt-db67d3ac52e3b07fc781505d"
  ],
  "tools": [
    "codex"
  ],
  "capture_status": "manual",
  "warnings": [],
  "operation": "commit",
  "replaces_ai_log": null
}
