{
  "schema_version": 1,
  "record_type": "commit_evidence",
  "ai_log_id": "log-085ef3e64afb48f58efe5c3a",
  "created_at": "2026-07-19T01:54:46.203275Z",
  "member_id": "nmhongtram",
  "branch": "tram",
  "parent_commit": "b00a52329c2e6fb7a8453a638503b25524b73f09",
  "task_records": [
    "local-20260718-ai-log-onboard"
  ],
  "prompt_ids": [],
  "tools": [],
  "capture_status": "no_new_prompt",
  "warnings": [],
  "operation": "commit",
  "replaces_ai_log": null
}
