{
  "schema_version": 1,
  "record_type": "commit_evidence",
  "ai_log_id": "log-37ff206ebf7649bca476fd85",
  "created_at": "2026-07-18T18:23:32.866269Z",
  "member_id": "nmhongtram",
  "branch": "tram",
  "parent_commit": "ee914c833bc58968995f8b074e94c6c19f077f9a",
  "task_records": [
    "local-20260718-ai-log-onboard"
  ],
  "prompt_ids": [],
  "tools": [],
  "capture_status": "no_new_prompt",
  "warnings": [],
  "operation": "commit",
  "replaces_ai_log": null
}
