{
  "schema_version": 1,
  "record_type": "commit_evidence",
  "ai_log_id": "log-9bd77fccee6348f0aa9caeb4",
  "created_at": "2026-07-19T17:59:17.924257Z",
  "member_id": "hdtruong802",
  "branch": "main",
  "parent_commit": "c532530981dcd56d179efe40f17b68564559a90b",
  "task_records": [
    "local-20260718-seeded-auth",
    "local-20260718-vngov-brand"
  ],
  "prompt_ids": [
    "prompt-151e393b752f03ffeb3b4074",
    "prompt-c78e28a5132c00e087dfd851"
  ],
  "tools": [
    "codex"
  ],
  "capture_status": "manual",
  "warnings": [],
  "operation": "commit",
  "replaces_ai_log": null
}
