{
  "schema_version": 1,
  "record_type": "commit_evidence",
  "ai_log_id": "log-48b5e190c87c4ef397bb9395",
  "created_at": "2026-07-19T03:06:46.216688Z",
  "member_id": "nmhongtram",
  "branch": "tram",
  "parent_commit": "4605d738de152daf555aa76a4b057e6c7e6a48f0",
  "task_records": [
    "local-20260718-ai-log-onboard"
  ],
  "prompt_ids": [],
  "tools": [],
  "capture_status": "no_new_prompt",
  "warnings": [],
  "operation": "commit",
  "replaces_ai_log": null
}
