{
  "schema_version": 1,
  "record_type": "commit_evidence",
  "ai_log_id": "log-12e3dcd2b7a046f8be0d42a0",
  "created_at": "2026-07-18T07:28:07.287360Z",
  "member_id": "hdtruong802",
  "branch": "truong",
  "parent_commit": "add579b33239596e0f82ddad267c7c6b9e961dd5",
  "task_records": [
    "local-20260718-truong-dev-sync"
  ],
  "prompt_ids": [
    "prompt-4c9e9d34a40e0d333695556f"
  ],
  "tools": [
    "codex"
  ],
  "capture_status": "manual",
  "warnings": [],
  "operation": "commit",
  "replaces_ai_log": null
}
