{
  "schema_version": 1,
  "record_type": "commit_evidence",
  "ai_log_id": "log-08c58fbababb46c39d93bce2",
  "created_at": "2026-07-19T03:04:16.907784Z",
  "member_id": "nmhongtram",
  "branch": "tram",
  "parent_commit": "67f2ca7c83709b20a7517a9f72770300c8ede408",
  "task_records": [
    "local-20260718-ai-log-onboard"
  ],
  "prompt_ids": [],
  "tools": [],
  "capture_status": "no_new_prompt",
  "warnings": [],
  "operation": "commit",
  "replaces_ai_log": null
}
